{"data":{},"datacontenttype":"application/json","dataschema":"urn:wdf:schema:job.started:1.0","id":"45a93569-b3dc-5ac0-b90a-683c3e68419d","jobclass":"simulate","jobid":"3a9617fa-df7c-5760-a644-42d559e0f433","priorityclass":"standard","source":"/wdf/workflow","specversion":"1.0","subject":"3a9617fa-df7c-5760-a644-42d559e0f433","tenant":"acme","time":"2026-10-30T12:00:00.123456Z","traceparent":"00-4bf92f3577b34da6a3ce929d0e0e4736-00f067aa0ba902b7-01","type":"dev.wdf.job.started.v1"}