{
  "attempt": 1,
  "data": {
    "checkpoint": {
      "kind": "checkpoint",
      "name": "state.bin",
      "producer": {
        "attempt": "r0a1",
        "job": "3a9617fa-df7c-5760-a644-42d559e0f433",
        "task": "sim"
      },
      "sha256": "9f86d081884c7d659a2feaa0c55ad015a3bf4f1b2b0b822cd15d6c15b0f00a08",
      "size": 4096,
      "uri": "s3://wdf-checkpoints/acme/b/j/7/sim/r0a1/0/state.bin"
    },
    "sequence": 2
  },
  "datacontenttype": "application/json",
  "dataschema": "urn:wdf:schema:task.checkpoint.committed:1.0",
  "id": "58877795-dde4-54ad-986c-1d131142d47b",
  "jobclass": "simulate",
  "jobid": "3a9617fa-df7c-5760-a644-42d559e0f433",
  "priorityclass": "standard",
  "source": "/wdf/workflow",
  "specversion": "1.0",
  "subject": "3a9617fa-df7c-5760-a644-42d559e0f433/sim",
  "taskid": "sim",
  "tenant": "acme",
  "time": "2026-10-30T12:00:00.123456Z",
  "traceparent": "00-4bf92f3577b34da6a3ce929d0e0e4736-00f067aa0ba902b7-01",
  "type": "dev.wdf.task.checkpoint.committed.v1"
}
