{
  "data": {
    "reason": "wrong input"
  },
  "datacontenttype": "application/json",
  "dataschema": "urn:wdf:schema:job.cancel.requested:1.0",
  "id": "a909f8ef-7003-5e6b-b2b1-a973a29e71be",
  "jobclass": "simulate",
  "jobid": "3a9617fa-df7c-5760-a644-42d559e0f433",
  "priorityclass": "standard",
  "source": "/wdf/control",
  "specversion": "1.0",
  "subject": "3a9617fa-df7c-5760-a644-42d559e0f433",
  "tenant": "acme",
  "time": "2026-10-30T12:00:00.123456Z",
  "traceparent": "00-4bf92f3577b34da6a3ce929d0e0e4736-00f067aa0ba902b7-01",
  "type": "dev.wdf.job.cancel.requested.v1"
}
