{"data":{"cpu_cores":1.5,"deadline":"2026-10-30T13:00:00.000000Z","inputs":[{"kind":"source","name":"model.json","sha256":"9f86d081884c7d659a2feaa0c55ad015a3bf4f1b2b0b822cd15d6c15b0f00a08","size":2048,"uri":"s3://wdf-sources/sha256/9f/9f86d081884c7d659a2feaa0c55ad015a3bf4f1b2b0b822cd15d6c15b0f00a08"}],"memory_mib":1024,"resume_checkpoint":{"kind":"checkpoint","name":"state.bin","producer":{"attempt":"r0a1","job":"3a9617fa-df7c-5760-a644-42d559e0f433","task":"sim"},"sha256":"9f86d081884c7d659a2feaa0c55ad015a3bf4f1b2b0b822cd15d6c15b0f00a08","size":4096,"uri":"s3://wdf-checkpoints/acme/b/j/7/sim/r0a1/0/state.bin"},"task_type":"simulate"},"datacontenttype":"application/json","dataschema":"urn:wdf:schema:task.requested:1.0","id":"4385af67-f5e8-5ade-9c8d-7da62b2b60c4","jobclass":"simulate","jobid":"3a9617fa-df7c-5760-a644-42d559e0f433","priorityclass":"standard","source":"/wdf/workflow","specversion":"1.0","subject":"3a9617fa-df7c-5760-a644-42d559e0f433/sim","taskid":"sim","tenant":"acme","time":"2026-10-30T12:00:00.123456Z","traceparent":"00-4bf92f3577b34da6a3ce929d0e0e4736-00f067aa0ba902b7-01","type":"dev.wdf.task.requested.v1"}